{
  "schema_version": 1,
  "purpose": "stable-launch-e2e",
  "consent": true,
  "mode": "fixture-only",
  "challenge": null,
  "run_id": "fixture-only",
  "run_attempt": "0",
  "catalog_sha": null,
  "scenario_contract_digest": "sha256:30a5a44dd6a1a32957dcba1a6d96ccb7c64f4fc7ed042a29bec6108f30011c32",
  "pseudonymous_identity_id": "fixture-contract-identity",
  "pseudonymous_workspace_id": "fixture-contract-workspace",
  "dedicated_identity": true,
  "disposable_project_status": "not-created",
  "operation_mode": "synthetic",
  "auth_origin": "none",
  "cleanup_outcome": "not-created",
  "no_real_project_proof": {
    "real_project_accessed": false,
    "absolute_paths_exported": false,
    "credential_material_exported": false,
    "auth_copied": false
  }
}
